{
    "id": "root",
    "role": "body",
    "content": {
        "type": "table",
        "value": {
            "column_widths": [
                { "fr": 2 },
                { "fr": 1 },
                { "pt": 100000 }
            ],
            "gap": 12000,
            "data": {
                "type": "inline",
                "rows": [
                    [
                        {
                            "id": "cell_0_0",
                            "role": "body",
                            "content": { "type": "text", "value": "Name" },
                            "modifiers": []
                        },
                        {
                            "id": "cell_0_1",
                            "role": "body",
                            "content": { "type": "text", "value": "Value" },
                            "modifiers": []
                        },
                        {
                            "id": "cell_0_2",
                            "role": "body",
                            "content": { "type": "text", "value": "Status" },
                            "modifiers": []
                        }
                    ],
                    [
                        {
                            "id": "cell_1_0",
                            "role": "body",
                            "content": { "type": "text", "value": "Item A" },
                            "modifiers": []
                        },
                        {
                            "id": "cell_1_1",
                            "role": "body",
                            "content": { "type": "text", "value": "$100.00" },
                            "modifiers": []
                        },
                        {
                            "id": "cell_1_2",
                            "role": "body",
                            "content": { "type": "text", "value": "Active" },
                            "modifiers": []
                        }
                    ]
                ]
            }
        }
    },
    "modifiers": []
}


